{
  "validation_targets": [
    {
      "validation_target_id": "VT001",
      "linked_contribution_id": "C1",
      "contribution_claim": "A joint layout-cabling optimization model for representing aerodynamic, electrical, economic, and feasibility trade-offs as a planned research contribution.",
      "linked_claim_id": "CL001",
      "linked_problem_id": "P001",
      "linked_theory_element_id": "TE001",
      "validation_claim_type": "model_validity_claim",
      "validation_question": "What experiment plan would make contribution C1 credible to a reviewer?",
      "hypothesis": "If C1 is valid, pre-registered comparisons should support the planned claim under equal computational budgets.",
      "required_evidence": [
        "baseline comparison",
        "claim-aligned metrics",
        "statistical analysis plan",
        "artifact traceability"
      ],
      "success_condition": "The contribution is supportable only if planned comparisons satisfy the evidence threshold without unsupported result language.",
      "failure_condition": "The contribution remains unsupported if the plan lacks aligned baselines, metrics, statistical analysis, or artifacts.",
      "evidence_threshold": "Evidence must include planned baseline, metric, ablation where applicable, statistical, and reproducibility links before empirical claims are written.",
      "required_experiment_types": [
        "baseline_comparison",
        "feasibility_analysis",
        "pareto_tradeoff_analysis"
      ],
      "validation_status": "validation_planned",
      "experiment_support_status": "directly_tested_by_plan",
      "reviewer_risk": "Reviewer may reject the contribution if validation evidence is weak, cherry-picked, or not reproducible.",
      "assumptions": [
        "This is a validation plan, not an experiment result."
      ],
      "limitations": [
        "Real experiments, numerical results, and significance conclusions are not generated by v0.3.0."
      ]
    },
    {
      "validation_target_id": "VT002",
      "linked_contribution_id": "C2",
      "contribution_claim": "A problem-structure-aware evolutionary mechanism for joint layout-cabling search, requiring ablation-based validation before any performance claim.",
      "linked_claim_id": "CL002",
      "linked_problem_id": "P001",
      "linked_theory_element_id": "TE001",
      "validation_claim_type": "algorithm_effectiveness_claim",
      "validation_question": "What experiment plan would make contribution C2 credible to a reviewer?",
      "hypothesis": "If C2 is valid, pre-registered comparisons should support the planned claim under equal computational budgets.",
      "required_evidence": [
        "baseline comparison",
        "claim-aligned metrics",
        "statistical analysis plan",
        "artifact traceability"
      ],
      "success_condition": "The contribution is supportable only if planned comparisons satisfy the evidence threshold without unsupported result language.",
      "failure_condition": "The contribution remains unsupported if the plan lacks aligned baselines, metrics, statistical analysis, or artifacts.",
      "evidence_threshold": "Evidence must include planned baseline, metric, ablation where applicable, statistical, and reproducibility links before empirical claims are written.",
      "required_experiment_types": [
        "ablation_study",
        "baseline_comparison"
      ],
      "validation_status": "validation_planned",
      "experiment_support_status": "directly_tested_by_plan",
      "reviewer_risk": "Reviewer may reject the contribution if validation evidence is weak, cherry-picked, or not reproducible.",
      "assumptions": [
        "This is a validation plan, not an experiment result."
      ],
      "limitations": [
        "Real experiments, numerical results, and significance conclusions are not generated by v0.3.0."
      ]
    },
    {
      "validation_target_id": "VT003",
      "linked_contribution_id": "C3",
      "contribution_claim": "An analysis plan for aerodynamic-electrical-economic Pareto trade-offs, requiring metrics and case studies before drawing conclusions.",
      "linked_claim_id": "CL003",
      "linked_problem_id": "P001",
      "linked_theory_element_id": "TE001",
      "validation_claim_type": "tradeoff_insight_claim",
      "validation_question": "What experiment plan would make contribution C3 credible to a reviewer?",
      "hypothesis": "If C3 is valid, pre-registered comparisons should support the planned claim under equal computational budgets.",
      "required_evidence": [
        "baseline comparison",
        "claim-aligned metrics",
        "statistical analysis plan",
        "artifact traceability"
      ],
      "success_condition": "The contribution is supportable only if planned comparisons satisfy the evidence threshold without unsupported result language.",
      "failure_condition": "The contribution remains unsupported if the plan lacks aligned baselines, metrics, statistical analysis, or artifacts.",
      "evidence_threshold": "Evidence must include planned baseline, metric, ablation where applicable, statistical, and reproducibility links before empirical claims are written.",
      "required_experiment_types": [
        "baseline_comparison",
        "pareto_tradeoff_analysis"
      ],
      "validation_status": "validation_planned",
      "experiment_support_status": "directly_tested_by_plan",
      "reviewer_risk": "Reviewer may reject the contribution if validation evidence is weak, cherry-picked, or not reproducible.",
      "assumptions": [
        "This is a validation plan, not an experiment result."
      ],
      "limitations": [
        "Real experiments, numerical results, and significance conclusions are not generated by v0.3.0."
      ]
    }
  ],
  "validation_target_summary": [
    {
      "validation_target_id": "VT001",
      "linked_contribution_id": "C1",
      "validation_status": "validation_planned"
    },
    {
      "validation_target_id": "VT002",
      "linked_contribution_id": "C2",
      "validation_status": "validation_planned"
    },
    {
      "validation_target_id": "VT003",
      "linked_contribution_id": "C3",
      "validation_status": "validation_planned"
    }
  ],
  "assumptions": [
    "Validation targets describe plans, not results."
  ],
  "limitations": [
    "Requires real experiment execution before empirical claims."
  ],
  "is_demo_plan": true,
  "requires_real_contribution_chain": true
}
